park_states,park_parkCode,park_designation,park_fullName,park_url,park_name,id,name
PA,alpo,National Historic Site,Allegheny Portage Railroad National Historic Site,https://www.nps.gov/alpo/index.htm,Allegheny Portage Railroad,0C0D142F-06B5-4BE1-8B44-491B90F93DEB,Park Film
TX,amis,National Recreation Area,Amistad National Recreation Area,https://www.nps.gov/amis/index.htm,Amistad,0C0D142F-06B5-4BE1-8B44-491B90F93DEB,Park Film
MP,amme,Park,American Memorial Park,https://www.nps.gov/amme/index.htm,American Memorial,0C0D142F-06B5-4BE1-8B44-491B90F93DEB,Park Film
GA,ande,National Historic Site,Andersonville National Historic Site,https://www.nps.gov/ande/index.htm,Andersonville,0C0D142F-06B5-4BE1-8B44-491B90F93DEB,Park Film
MD,anti,National Battlefield,Antietam National Battlefield,https://www.nps.gov/anti/index.htm,Antietam,0C0D142F-06B5-4BE1-8B44-491B90F93DEB,Park Film
VA,apco,National Historical Park,Appomattox Court House National Historical Park,https://www.nps.gov/apco/index.htm,Appomattox Court House,0C0D142F-06B5-4BE1-8B44-491B90F93DEB,Park Film
WI,apis,National Lakeshore,Apostle Islands National Lakeshore,https://www.nps.gov/apis/index.htm,Apostle Islands,0C0D142F-06B5-4BE1-8B44-491B90F93DEB,Park Film
AR,arpo,National Memorial,Arkansas Post National Memorial,https://www.nps.gov/arpo/index.htm,Arkansas Post,0C0D142F-06B5-4BE1-8B44-491B90F93DEB,Park Film
"MD,VA",asis,National Seashore,Assateague Island National Seashore,https://www.nps.gov/asis/index.htm,Assateague Island,0C0D142F-06B5-4BE1-8B44-491B90F93DEB,Park Film
NM,azru,National Monument,Aztec Ruins National Monument,https://www.nps.gov/azru/index.htm,Aztec Ruins,0C0D142F-06B5-4BE1-8B44-491B90F93DEB,Park Film
SD,badl,National Park,Badlands National Park,https://www.nps.gov/badl/index.htm,Badlands,0C0D142F-06B5-4BE1-8B44-491B90F93DEB,Park Film
NM,band,National Monument,Bandelier National Monument,https://www.nps.gov/band/index.htm,Bandelier,0C0D142F-06B5-4BE1-8B44-491B90F93DEB,Park Film
CO,beol,National Historic Site,Bent's Old Fort National Historic Site,https://www.nps.gov/beol/index.htm,Bent's Old Fort,0C0D142F-06B5-4BE1-8B44-491B90F93DEB,Park Film
TX,bibe,National Park,Big Bend National Park,https://www.nps.gov/bibe/index.htm,Big Bend,0C0D142F-06B5-4BE1-8B44-491B90F93DEB,Park Film
"MT,WY",bica,National Recreation Area,Bighorn Canyon National Recreation Area,https://www.nps.gov/bica/index.htm,Bighorn Canyon,0C0D142F-06B5-4BE1-8B44-491B90F93DEB,Park Film
FL,bicy,National Preserve,Big Cypress National Preserve,https://www.nps.gov/bicy/index.htm,Big Cypress,0C0D142F-06B5-4BE1-8B44-491B90F93DEB,Park Film
MT,biho,National Battlefield,Big Hole National Battlefield,https://www.nps.gov/biho/index.htm,Big Hole,0C0D142F-06B5-4BE1-8B44-491B90F93DEB,Park Film
FL,bisc,National Park,Biscayne National Park,https://www.nps.gov/bisc/index.htm,Biscayne,0C0D142F-06B5-4BE1-8B44-491B90F93DEB,Park Film
"KY,TN",biso,National River & Recreation Area,Big South Fork National River & Recreation Area,https://www.nps.gov/biso/index.htm,Big South Fork,0C0D142F-06B5-4BE1-8B44-491B90F93DEB,Park Film
TX,bith,National Preserve,Big Thicket National Preserve,https://www.nps.gov/bith/index.htm,Big Thicket,0C0D142F-06B5-4BE1-8B44-491B90F93DEB,Park Film
CO,blca,National Park,Black Canyon Of The Gunnison National Park,https://www.nps.gov/blca/index.htm,Black Canyon Of The Gunnison,0C0D142F-06B5-4BE1-8B44-491B90F93DEB,Park Film
VA,bowa,National Monument,Booker T Washington National Monument,https://www.nps.gov/bowa/index.htm,Booker T Washington,0C0D142F-06B5-4BE1-8B44-491B90F93DEB,Park Film
UT,brca,National Park,Bryce Canyon National Park,https://www.nps.gov/brca/index.htm,Bryce Canyon,0C0D142F-06B5-4BE1-8B44-491B90F93DEB,Park Film
KS,brvb,National Historical Park,Brown v. Board of Education National Historical Park,https://www.nps.gov/brvb/index.htm,Brown v. Board of Education,0C0D142F-06B5-4BE1-8B44-491B90F93DEB,Park Film
AR,buff,National River,Buffalo National River,https://www.nps.gov/buff/index.htm,Buffalo,0C0D142F-06B5-4BE1-8B44-491B90F93DEB,Park Film
CA,cabr,National Monument,Cabrillo National Monument,https://www.nps.gov/cabr/index.htm,Cabrillo,0C0D142F-06B5-4BE1-8B44-491B90F93DEB,Park Film
MA,caco,National Seashore,Cape Cod National Seashore,https://www.nps.gov/caco/index.htm,Cape Cod,0C0D142F-06B5-4BE1-8B44-491B90F93DEB,Park Film
AZ,cagr,National Monument,Casa Grande Ruins National Monument,https://www.nps.gov/cagr/index.htm,Casa Grande Ruins,0C0D142F-06B5-4BE1-8B44-491B90F93DEB,Park Film
FL,cana,National Seashore,Canaveral National Seashore,https://www.nps.gov/cana/index.htm,Canaveral,0C0D142F-06B5-4BE1-8B44-491B90F93DEB,Park Film
KY,cane,National Monument,Camp Nelson National Monument,https://www.nps.gov/cane/index.htm,Camp Nelson,0C0D142F-06B5-4BE1-8B44-491B90F93DEB,Park Film
UT,cany,National Park,Canyonlands National Park,https://www.nps.gov/cany/index.htm,Canyonlands,0C0D142F-06B5-4BE1-8B44-491B90F93DEB,Park Film
UT,care,National Park,Capitol Reef National Park,https://www.nps.gov/care/index.htm,Capitol Reef,0C0D142F-06B5-4BE1-8B44-491B90F93DEB,Park Film
FL,casa,National Monument,Castillo de San Marcos National Monument,https://www.nps.gov/casa/index.htm,Castillo de San Marcos,0C0D142F-06B5-4BE1-8B44-491B90F93DEB,Park Film
NM,cave,National Park,Carlsbad Caverns National Park,https://www.nps.gov/cave/index.htm,Carlsbad Caverns,0C0D142F-06B5-4BE1-8B44-491B90F93DEB,Park Film
DC,cawo,National Historic Site,Carter G. Woodson Home National Historic Site,https://www.nps.gov/cawo/index.htm,Carter G. Woodson Home,0C0D142F-06B5-4BE1-8B44-491B90F93DEB,Park Film
TX,cham,National Memorial,Chamizal National Memorial,https://www.nps.gov/cham/index.htm,Chamizal,0C0D142F-06B5-4BE1-8B44-491B90F93DEB,Park Film
"GA,TN",chch,National Military Park,Chickamauga & Chattanooga National Military Park,https://www.nps.gov/chch/index.htm,Chickamauga & Chattanooga,0C0D142F-06B5-4BE1-8B44-491B90F93DEB,Park Film
CA,chis,National Park,Channel Islands National Park,https://www.nps.gov/chis/index.htm,Channel Islands,0C0D142F-06B5-4BE1-8B44-491B90F93DEB,Park Film
SC,chpi,National Historic Site,Charles Pinckney National Historic Site,https://www.nps.gov/chpi/index.htm,Charles Pinckney,0C0D142F-06B5-4BE1-8B44-491B90F93DEB,Park Film
AR,chsc,National Historic Site,Little Rock Central High School National Historic Site,https://www.nps.gov/chsc/index.htm,Little Rock Central High School,0C0D142F-06B5-4BE1-8B44-491B90F93DEB,Park Film
OH,chyo,National Monument,Charles Young Buffalo Soldiers National Monument,https://www.nps.gov/chyo/index.htm,Charles Young Buffalo Soldiers,0C0D142F-06B5-4BE1-8B44-491B90F93DEB,Park Film
CO,colm,National Monument,Colorado National Monument,https://www.nps.gov/colm/index.htm,Colorado,0C0D142F-06B5-4BE1-8B44-491B90F93DEB,Park Film
SC,cowp,National Battlefield,Cowpens National Battlefield,https://www.nps.gov/cowp/index.htm,Cowpens,0C0D142F-06B5-4BE1-8B44-491B90F93DEB,Park Film
OR,crla,National Park,Crater Lake National Park,https://www.nps.gov/crla/index.htm,Crater Lake,0C0D142F-06B5-4BE1-8B44-491B90F93DEB,Park Film
ID,crmo,National Monument & Preserve,Craters Of The Moon National Monument & Preserve,https://www.nps.gov/crmo/index.htm,Craters Of The Moon,0C0D142F-06B5-4BE1-8B44-491B90F93DEB,Park Film
"KY,TN,VA",cuga,National Historical Park,Cumberland Gap National Historical Park,https://www.nps.gov/cuga/index.htm,Cumberland Gap,0C0D142F-06B5-4BE1-8B44-491B90F93DEB,Park Film
"DC,MD,VA",cwdw,,Civil War Defenses of Washington,https://www.nps.gov/cwdw/index.htm,Civil War Defenses of Washington,0C0D142F-06B5-4BE1-8B44-491B90F93DEB,Park Film
OH,daav,National Historical Park,Dayton Aviation Heritage National Historical Park,https://www.nps.gov/daav/index.htm,Dayton Aviation Heritage,0C0D142F-06B5-4BE1-8B44-491B90F93DEB,Park Film
AK,dena,National Park & Preserve,Denali National Park & Preserve,https://www.nps.gov/dena/index.htm,Denali,0C0D142F-06B5-4BE1-8B44-491B90F93DEB,Park Film
"CA,NV",deva,National Park,Death Valley National Park,https://www.nps.gov/deva/index.htm,Death Valley,0C0D142F-06B5-4BE1-8B44-491B90F93DEB,Park Film
"CO,UT",dino,National Monument,Dinosaur National Monument,https://www.nps.gov/dino/index.htm,Dinosaur,0C0D142F-06B5-4BE1-8B44-491B90F93DEB,Park Film
"NJ,NY",elis,Part of Statue of Liberty National Monument,Ellis Island Part of Statue of Liberty National Monument,https://www.nps.gov/elis/index.htm,Ellis Island,0C0D142F-06B5-4BE1-8B44-491B90F93DEB,Park Film
NM,elma,National Monument,El Malpais National Monument,https://www.nps.gov/elma/index.htm,El Malpais,0C0D142F-06B5-4BE1-8B44-491B90F93DEB,Park Film
NM,elmo,National Monument,El Morro National Monument,https://www.nps.gov/elmo/index.htm,El Morro,0C0D142F-06B5-4BE1-8B44-491B90F93DEB,Park Film
FL,ever,National Park,Everglades National Park,https://www.nps.gov/ever/index.htm,Everglades,0C0D142F-06B5-4BE1-8B44-491B90F93DEB,Park Film
OH,fila,National Historic Site,First Ladies National Historic Site,https://www.nps.gov/fila/index.htm,First Ladies,0C0D142F-06B5-4BE1-8B44-491B90F93DEB,Park Film
CO,flfo,National Monument,Florissant Fossil Beds National Monument,https://www.nps.gov/flfo/index.htm,Florissant Fossil Beds,0C0D142F-06B5-4BE1-8B44-491B90F93DEB,Park Film
TX,foda,National Historic Site,Fort Davis National Historic Site,https://www.nps.gov/foda/index.htm,Fort Davis,0C0D142F-06B5-4BE1-8B44-491B90F93DEB,Park Film
"KY,TN",fodo,National Battlefield,Fort Donelson National Battlefield,https://www.nps.gov/fodo/index.htm,Fort Donelson,0C0D142F-06B5-4BE1-8B44-491B90F93DEB,Park Film
GA,fofr,National Monument,Fort Frederica National Monument,https://www.nps.gov/fofr/index.htm,Fort Frederica,0C0D142F-06B5-4BE1-8B44-491B90F93DEB,Park Film
KS,fols,National Historic Site,Fort Larned National Historic Site,https://www.nps.gov/fols/index.htm,Fort Larned,0C0D142F-06B5-4BE1-8B44-491B90F93DEB,Park Film
MD,fomc,National Monument and Historic Shrine,Fort McHenry National Monument and Historic Shrine,https://www.nps.gov/fomc/index.htm,Fort McHenry,0C0D142F-06B5-4BE1-8B44-491B90F93DEB,Park Film
PA,fone,National Battlefield,Fort Necessity National Battlefield,https://www.nps.gov/fone/index.htm,Fort Necessity,0C0D142F-06B5-4BE1-8B44-491B90F93DEB,Park Film
CA,fopo,National Historic Site,Fort Point National Historic Site,https://www.nps.gov/fopo/index.htm,Fort Point,0C0D142F-06B5-4BE1-8B44-491B90F93DEB,Park Film
GA,fopu,National Monument,Fort Pulaski National Monument,https://www.nps.gov/fopu/index.htm,Fort Pulaski,0C0D142F-06B5-4BE1-8B44-491B90F93DEB,Park Film
NC,fora,National Historic Site,Fort Raleigh National Historic Site,https://www.nps.gov/fora/index.htm,Fort Raleigh,0C0D142F-06B5-4BE1-8B44-491B90F93DEB,Park Film
KS,fosc,National Historic Site,Fort Scott National Historic Site,https://www.nps.gov/fosc/index.htm,Fort Scott,0C0D142F-06B5-4BE1-8B44-491B90F93DEB,Park Film
"AR,OK",fosm,National Historic Site,Fort Smith National Historic Site,https://www.nps.gov/fosm/index.htm,Fort Smith,0C0D142F-06B5-4BE1-8B44-491B90F93DEB,Park Film
NY,fost,National Monument,Fort Stanwix National Monument,https://www.nps.gov/fost/index.htm,Fort Stanwix,0C0D142F-06B5-4BE1-8B44-491B90F93DEB,Park Film
SC,fosu,National Historical Park,Fort Sumter and Fort Moultrie National Historical Park,https://www.nps.gov/fosu/index.htm,Fort Sumter and Fort Moultrie,0C0D142F-06B5-4BE1-8B44-491B90F93DEB,Park Film
"MT,ND",fous,National Historic Site,Fort Union Trading Post National Historic Site,https://www.nps.gov/fous/index.htm,Fort Union Trading Post,0C0D142F-06B5-4BE1-8B44-491B90F93DEB,Park Film
"OR,WA",fova,National Historic Site,Fort Vancouver National Historic Site,https://www.nps.gov/fova/index.htm,Fort Vancouver,0C0D142F-06B5-4BE1-8B44-491B90F93DEB,Park Film
DC,frdo,National Historic Site,Frederick Douglass National Historic Site,https://www.nps.gov/frdo/index.htm,Frederick Douglass,0C0D142F-06B5-4BE1-8B44-491B90F93DEB,Park Film
PA,frhi,National Historic Site,Friendship Hill National Historic Site,https://www.nps.gov/frhi/index.htm,Friendship Hill,0C0D142F-06B5-4BE1-8B44-491B90F93DEB,Park Film
VA,frsp,National Military Park,Fredericksburg & Spotsylvania National Military Park,https://www.nps.gov/frsp/index.htm,Fredericksburg & Spotsylvania,0C0D142F-06B5-4BE1-8B44-491B90F93DEB,Park Film
NY,gegr,National Memorial,General Grant National Memorial,https://www.nps.gov/gegr/index.htm,General Grant,0C0D142F-06B5-4BE1-8B44-491B90F93DEB,Park Film
IN,gero,National Historical Park,George Rogers Clark National Historical Park,https://www.nps.gov/gero/index.htm,George Rogers Clark,0C0D142F-06B5-4BE1-8B44-491B90F93DEB,Park Film
PA,gett,National Military Park,Gettysburg National Military Park,https://www.nps.gov/gett/index.htm,Gettysburg,0C0D142F-06B5-4BE1-8B44-491B90F93DEB,Park Film
NM,gicl,National Monument,Gila Cliff Dwellings National Monument,https://www.nps.gov/gicl/index.htm,Gila Cliff Dwellings,0C0D142F-06B5-4BE1-8B44-491B90F93DEB,Park Film
MT,glac,National Park,Glacier National Park,https://www.nps.gov/glac/index.htm,Glacier,0C0D142F-06B5-4BE1-8B44-491B90F93DEB,Park Film
AK,glba,National Park & Preserve,Glacier Bay National Park & Preserve,https://www.nps.gov/glba/index.htm,Glacier Bay,0C0D142F-06B5-4BE1-8B44-491B90F93DEB,Park Film
UT,gosp,National Historical Park,Golden Spike National Historical Park,https://www.nps.gov/gosp/index.htm,Golden Spike,0C0D142F-06B5-4BE1-8B44-491B90F93DEB,Park Film
NV,grba,National Park,Great Basin National Park,https://www.nps.gov/grba/index.htm,Great Basin,0C0D142F-06B5-4BE1-8B44-491B90F93DEB,Park Film
AZ,grca,National Park,Grand Canyon National Park,https://www.nps.gov/grca/index.htm,Grand Canyon,0C0D142F-06B5-4BE1-8B44-491B90F93DEB,Park Film
VA,grfa,Park,Great Falls Park,https://www.nps.gov/grfa/index.htm,Great Falls,0C0D142F-06B5-4BE1-8B44-491B90F93DEB,Park Film
MN,grpo,National Monument,Grand Portage National Monument,https://www.nps.gov/grpo/index.htm,Grand Portage,0C0D142F-06B5-4BE1-8B44-491B90F93DEB,Park Film
CO,grsa,National Park & Preserve,Great Sand Dunes National Park & Preserve,https://www.nps.gov/grsa/index.htm,Great Sand Dunes,0C0D142F-06B5-4BE1-8B44-491B90F93DEB,Park Film
"NC,TN",grsm,National Park,Great Smoky Mountains National Park,https://www.nps.gov/grsm/index.htm,Great Smoky Mountains,0C0D142F-06B5-4BE1-8B44-491B90F93DEB,Park Film
NC,guco,National Military Park,Guilford Courthouse National Military Park,https://www.nps.gov/guco/index.htm,Guilford Courthouse,0C0D142F-06B5-4BE1-8B44-491B90F93DEB,Park Film
"FL,MS",guis,National Seashore,Gulf Islands National Seashore,https://www.nps.gov/guis/index.htm,Gulf Islands,0C0D142F-06B5-4BE1-8B44-491B90F93DEB,Park Film
MO,gwca,National Monument,George Washington Carver National Monument,https://www.nps.gov/gwca/index.htm,George Washington Carver,0C0D142F-06B5-4BE1-8B44-491B90F93DEB,Park Film
NY,hagr,National Memorial,Hamilton Grange National Memorial,https://www.nps.gov/hagr/index.htm,Hamilton Grange,0C0D142F-06B5-4BE1-8B44-491B90F93DEB,Park Film
MD,hatu,National Historical Park,Harriet Tubman Underground Railroad National Historical Park,https://www.nps.gov/hatu/index.htm,Harriet Tubman Underground Railroad,0C0D142F-06B5-4BE1-8B44-491B90F93DEB,Park Film
HI,havo,National Park,Hawaiʻi Volcanoes National Park,https://www.nps.gov/havo/index.htm,Hawaiʻi Volcanoes,0C0D142F-06B5-4BE1-8B44-491B90F93DEB,Park Film
IA,heho,National Historic Site,Herbert Hoover National Historic Site,https://www.nps.gov/heho/index.htm,Herbert Hoover,0C0D142F-06B5-4BE1-8B44-491B90F93DEB,Park Film
AL,hobe,National Military Park,Horseshoe Bend National Military Park,https://www.nps.gov/hobe/index.htm,Horseshoe Bend,0C0D142F-06B5-4BE1-8B44-491B90F93DEB,Park Film
PA,hofu,National Historic Site,Hopewell Furnace National Historic Site,https://www.nps.gov/hofu/index.htm,Hopewell Furnace,0C0D142F-06B5-4BE1-8B44-491B90F93DEB,Park Film
NE,home,National Historical Park,Homestead National Historical Park,https://www.nps.gov/home/index.htm,Homestead,0C0D142F-06B5-4BE1-8B44-491B90F93DEB,Park Film
AR,hosp,National Park,Hot Springs National Park,https://www.nps.gov/hosp/index.htm,Hot Springs,0C0D142F-06B5-4BE1-8B44-491B90F93DEB,Park Film
"CO,UT",hove,National Monument,Hovenweep National Monument,https://www.nps.gov/hove/index.htm,Hovenweep,0C0D142F-06B5-4BE1-8B44-491B90F93DEB,Park Film
MO,hstr,National Historic Site,Harry S Truman National Historic Site,https://www.nps.gov/hstr/index.htm,Harry S Truman,0C0D142F-06B5-4BE1-8B44-491B90F93DEB,Park Film
PA,inde,National Historical Park,Independence National Historical Park,https://www.nps.gov/inde/index.htm,Independence,0C0D142F-06B5-4BE1-8B44-491B90F93DEB,Park Film
IN,indu,National Park,Indiana Dunes National Park,https://www.nps.gov/indu/index.htm,Indiana Dunes,0C0D142F-06B5-4BE1-8B44-491B90F93DEB,Park Film
MI,isro,National Park,Isle Royale National Park,https://www.nps.gov/isro/index.htm,Isle Royale,0C0D142F-06B5-4BE1-8B44-491B90F93DEB,Park Film
OH,jaga,National Historic Site,James A Garfield National Historic Site,https://www.nps.gov/jaga/index.htm,James A Garfield,0C0D142F-06B5-4BE1-8B44-491B90F93DEB,Park Film
SD,jeca,National Monument,Jewel Cave National Monument,https://www.nps.gov/jeca/index.htm,Jewel Cave,0C0D142F-06B5-4BE1-8B44-491B90F93DEB,Park Film
MO,jeff,National Park,Gateway Arch National Park,https://www.nps.gov/jeff/index.htm,Gateway Arch,0C0D142F-06B5-4BE1-8B44-491B90F93DEB,Park Film
LA,jela,National Historical Park and Preserve,Jean Lafitte National Historical Park and Preserve,https://www.nps.gov/jela/index.htm,Jean Lafitte,0C0D142F-06B5-4BE1-8B44-491B90F93DEB,Park Film
GA,jica,National Historical Park,Jimmy Carter National Historical Park,https://www.nps.gov/jica/index.htm,Jimmy Carter,0C0D142F-06B5-4BE1-8B44-491B90F93DEB,Park Film
OR,joda,National Monument,John Day Fossil Beds National Monument,https://www.nps.gov/joda/index.htm,John Day Fossil Beds,0C0D142F-06B5-4BE1-8B44-491B90F93DEB,Park Film
MA,jofi,National Historic Site,John Fitzgerald Kennedy National Historic Site,https://www.nps.gov/jofi/index.htm,John Fitzgerald Kennedy,0C0D142F-06B5-4BE1-8B44-491B90F93DEB,Park Film
PA,jofl,National Memorial,Johnstown Flood National Memorial,https://www.nps.gov/jofl/index.htm,Johnstown Flood,0C0D142F-06B5-4BE1-8B44-491B90F93DEB,Park Film
CA,jomu,National Historic Site,John Muir National Historic Site,https://www.nps.gov/jomu/index.htm,John Muir,0C0D142F-06B5-4BE1-8B44-491B90F93DEB,Park Film
"AZ,CA",juba,National Historic Trail,Juan Bautista de Anza National Historic Trail,https://www.nps.gov/juba/index.htm,Juan Bautista de Anza,0C0D142F-06B5-4BE1-8B44-491B90F93DEB,Park Film
HI,kaho,National Historical Park,Kaloko-Honokōhau National Historical Park,https://www.nps.gov/kaho/index.htm,Kaloko-Honokōhau,0C0D142F-06B5-4BE1-8B44-491B90F93DEB,Park Film
AK,katm,National Park & Preserve,Katmai National Park & Preserve,https://www.nps.gov/katm/index.htm,Katmai,0C0D142F-06B5-4BE1-8B44-491B90F93DEB,Park Film
AK,kefj,National Park,Kenai Fjords National Park,https://www.nps.gov/kefj/index.htm,Kenai Fjords,0C0D142F-06B5-4BE1-8B44-491B90F93DEB,Park Film
MI,kewe,National Historical Park,Keweenaw National Historical Park,https://www.nps.gov/kewe/index.htm,Keweenaw,0C0D142F-06B5-4BE1-8B44-491B90F93DEB,Park Film
SC,kimo,National Military Park,Kings Mountain National Military Park,https://www.nps.gov/kimo/index.htm,Kings Mountain,0C0D142F-06B5-4BE1-8B44-491B90F93DEB,Park Film
AK,klgo,National Historical Park,Klondike Gold Rush National Historical Park,https://www.nps.gov/klgo/index.htm,Klondike Gold Rush,0C0D142F-06B5-4BE1-8B44-491B90F93DEB,Park Film
WA,klse,National Historical Park,Klondike Gold Rush - Seattle Unit National Historical Park,https://www.nps.gov/klse/index.htm,Klondike Gold Rush - Seattle Unit,0C0D142F-06B5-4BE1-8B44-491B90F93DEB,Park Film
ND,knri,National Historic Site,Knife River Indian Villages National Historic Site,https://www.nps.gov/knri/index.htm,Knife River Indian Villages,0C0D142F-06B5-4BE1-8B44-491B90F93DEB,Park Film
CA,labe,National Monument,Lava Beds National Monument,https://www.nps.gov/labe/index.htm,Lava Beds,0C0D142F-06B5-4BE1-8B44-491B90F93DEB,Park Film
"AZ,NV",lake,National Recreation Area,Lake Mead National Recreation Area,https://www.nps.gov/lake/index.htm,Lake Mead,0C0D142F-06B5-4BE1-8B44-491B90F93DEB,Park Film
WA,laro,National Recreation Area,Lake Roosevelt National Recreation Area,https://www.nps.gov/laro/index.htm,Lake Roosevelt,0C0D142F-06B5-4BE1-8B44-491B90F93DEB,Park Film
CA,lavo,National Park,Lassen Volcanic National Park,https://www.nps.gov/lavo/index.htm,Lassen Volcanic,0C0D142F-06B5-4BE1-8B44-491B90F93DEB,Park Film
"OR,WA",lewi,National Historical Park,Lewis and Clark National Historical Park,https://www.nps.gov/lewi/index.htm,Lewis and Clark,0C0D142F-06B5-4BE1-8B44-491B90F93DEB,Park Film
IN,libo,National Memorial,Lincoln Boyhood National Memorial,https://www.nps.gov/libo/index.htm,Lincoln Boyhood,0C0D142F-06B5-4BE1-8B44-491B90F93DEB,Park Film
IL,liho,National Historic Site,Lincoln Home National Historic Site,https://www.nps.gov/liho/index.htm,Lincoln Home,0C0D142F-06B5-4BE1-8B44-491B90F93DEB,Park Film
MA,lowe,National Historical Park,Lowell National Historical Park,https://www.nps.gov/lowe/index.htm,Lowell,0C0D142F-06B5-4BE1-8B44-491B90F93DEB,Park Film
TX,lyjo,National Historical Park,Lyndon B Johnson National Historical Park,https://www.nps.gov/lyjo/index.htm,Lyndon B Johnson,0C0D142F-06B5-4BE1-8B44-491B90F93DEB,Park Film
VT,mabi,National Historical Park,Marsh - Billings - Rockefeller National Historical Park,https://www.nps.gov/mabi/index.htm,Marsh - Billings - Rockefeller,0C0D142F-06B5-4BE1-8B44-491B90F93DEB,Park Film
KY,maca,National Park,Mammoth Cave National Park,https://www.nps.gov/maca/index.htm,Mammoth Cave,0C0D142F-06B5-4BE1-8B44-491B90F93DEB,Park Film
DC,mamc,"National Historic Site
",Mary McLeod Bethune Council House National Historic Site,https://www.nps.gov/mamc/index.htm,Mary McLeod Bethune Council House,0C0D142F-06B5-4BE1-8B44-491B90F93DEB,Park Film
VA,mana,National Battlefield Park,Manassas National Battlefield Park,https://www.nps.gov/mana/index.htm,Manassas,0C0D142F-06B5-4BE1-8B44-491B90F93DEB,Park Film
CA,manz,National Historic Site,Manzanar National Historic Site,https://www.nps.gov/manz/index.htm,Manzanar,0C0D142F-06B5-4BE1-8B44-491B90F93DEB,Park Film
"NM,WA,TN",mapr,National Historical Park,Manhattan Project National Historical Park,https://www.nps.gov/mapr/index.htm,Manhattan Project,0C0D142F-06B5-4BE1-8B44-491B90F93DEB,Park Film
NY,mava,National Historic Site,Martin Van Buren National Historic Site,https://www.nps.gov/mava/index.htm,Martin Van Buren,0C0D142F-06B5-4BE1-8B44-491B90F93DEB,Park Film
CO,meve,National Park,Mesa Verde National Park,https://www.nps.gov/meve/index.htm,Mesa Verde,0C0D142F-06B5-4BE1-8B44-491B90F93DEB,Park Film
SD,mimi,National Historic Site,Minuteman Missile National Historic Site,https://www.nps.gov/mimi/index.htm,Minuteman Missile,0C0D142F-06B5-4BE1-8B44-491B90F93DEB,Park Film
KY,misp,National Monument,Mill Springs Battlefield National Monument,https://www.nps.gov/misp/index.htm,Mill Springs Battlefield,0C0D142F-06B5-4BE1-8B44-491B90F93DEB,Park Film
"SD,NE",mnrr,National Recreational River,Missouri National Recreational River,https://www.nps.gov/mnrr/index.htm,Missouri,0C0D142F-06B5-4BE1-8B44-491B90F93DEB,Park Film
NC,mocr,National Battlefield,Moores Creek National Battlefield,https://www.nps.gov/mocr/index.htm,Moores Creek,0C0D142F-06B5-4BE1-8B44-491B90F93DEB,Park Film
CA,moja,National Preserve,Mojave National Preserve,https://www.nps.gov/moja/index.htm,Mojave,0C0D142F-06B5-4BE1-8B44-491B90F93DEB,Park Film
WA,mora,National Park,Mount Rainier National Park,https://www.nps.gov/mora/index.htm,Mount Rainier,0C0D142F-06B5-4BE1-8B44-491B90F93DEB,Park Film
NJ,morr,National Historical Park,Morristown National Historical Park,https://www.nps.gov/morr/index.htm,Morristown,0C0D142F-06B5-4BE1-8B44-491B90F93DEB,Park Film
SD,moru,National Memorial,Mount Rushmore National Memorial,https://www.nps.gov/moru/index.htm,Mount Rushmore,0C0D142F-06B5-4BE1-8B44-491B90F93DEB,Park Film
UT,nabr,National Monument,Natural Bridges National Monument,https://www.nps.gov/nabr/index.htm,Natural Bridges,0C0D142F-06B5-4BE1-8B44-491B90F93DEB,Park Film
"AL,MS,TN",natr,Parkway,Natchez Trace Parkway,https://www.nps.gov/natr/index.htm,Natchez Trace,0C0D142F-06B5-4BE1-8B44-491B90F93DEB,Park Film
"ID,MT,OR,WA",nepe,National Historical Park,Nez Perce National Historical Park,https://www.nps.gov/nepe/index.htm,Nez Perce,0C0D142F-06B5-4BE1-8B44-491B90F93DEB,Park Film
WV,neri,National Park & Preserve,New River Gorge National Park & Preserve,https://www.nps.gov/neri/index.htm,New River Gorge,0C0D142F-06B5-4BE1-8B44-491B90F93DEB,Park Film
KS,nico,National Historic Site,Nicodemus National Historic Site,https://www.nps.gov/nico/index.htm,Nicodemus,0C0D142F-06B5-4BE1-8B44-491B90F93DEB,Park Film
NE,niob,National Scenic River,Niobrara National Scenic River,https://www.nps.gov/niob/index.htm,Niobrara,0C0D142F-06B5-4BE1-8B44-491B90F93DEB,Park Film
SC,nisi,National Historic Site,Ninety Six National Historic Site,https://www.nps.gov/nisi/index.htm,Ninety Six,0C0D142F-06B5-4BE1-8B44-491B90F93DEB,Park Film
NY,npnh,,National Parks of New York Harbor,https://www.nps.gov/npnh/index.htm,National Parks of New York Harbor,0C0D142F-06B5-4BE1-8B44-491B90F93DEB,Park Film
TN,obed,Wild & Scenic River,Obed Wild & Scenic River,https://www.nps.gov/obed/index.htm,Obed,0C0D142F-06B5-4BE1-8B44-491B90F93DEB,Park Film
GA,ocmu,National Historical Park,Ocmulgee Mounds National Historical Park,https://www.nps.gov/ocmu/index.htm,Ocmulgee Mounds,0C0D142F-06B5-4BE1-8B44-491B90F93DEB,Park Film
WA,olym,National Park,Olympic National Park,https://www.nps.gov/olym/index.htm,Olympic,0C0D142F-06B5-4BE1-8B44-491B90F93DEB,Park Film
AZ,orpi,National Monument,Organ Pipe Cactus National Monument,https://www.nps.gov/orpi/index.htm,Organ Pipe Cactus,0C0D142F-06B5-4BE1-8B44-491B90F93DEB,Park Film
